{
  "batch_id": "INKYUNG-20-A",
  "schema_version": "0.1",
  "zone": "C04_INKYUNG",
  "npc_count": 20,
  "npcs": [
    {
      "npc_id": "INKYUNG-NPC-001",
      "archetype": "student",
      "identity": {
        "name": "나나율",
        "age_band": "mid_20s",
        "department_type": "humanities",
        "year_level": 4
      },
      "personality": {
        "traits": [
          "thoughtful",
          "gentle",
          "curious"
        ],
        "social_energy": 0.84,
        "talkativeness": 0.62,
        "routine_preference": 0.32
      },
      "speech": {
        "tone": "casual_polite",
        "tempo": "normal",
        "quirks": [
          "short_sentences"
        ]
      },
      "interests": [
        "architecture",
        "cooking",
        "sketching"
      ],
      "home_zone": "C04_INKYUNG",
      "schedule": {
        "morning": {
          "location": "inkyung_spawn",
          "activity": "idle",
          "social_mode": "high"
        },
        "class_time": {
          "location": "inkyung_waterfront",
          "activity": "read",
          "social_mode": "high"
        },
        "lunch": {
          "location": "inkyung_bench_east",
          "activity": "sit",
          "social_mode": "high"
        },
        "evening": {
          "location": "off_zone",
          "activity": "leave_zone",
          "social_mode": "low"
        }
      },
      "relationships": [
        {
          "target_id": "INKYUNG-NPC-006",
          "type": "friend"
        }
      ],
      "dialogue_hooks": {
        "morning": [
          "아침 인경호 입구에서 잠깐 멈춰 있어요.",
          "건물 선을 스케치하려다 아직 연필만 고르고 있네요."
        ],
        "class_time": [
          "수업 시간에는 호수 물가에서 짧은 글을 읽어요.",
          "문장 사이를 쉬어 가듯 읽는 편이에요."
        ],
        "lunch": [
          "점심엔 동쪽 벤치에 앉아 쉬고 있어요.",
          "다음에 그릴 풍경을 머릿속으로 먼저 접어 봐요."
        ],
        "evening": [
          "저녁이 되어 이 구역 밖으로 나가요.",
          "돌아가면 간단한 음식을 만들어 볼 생각이에요."
        ]
      },
      "behavior_tags": [
        "slow_paced",
        "outgoing"
      ],
      "constraints": {
        "is_authored_npc": false,
        "can_start_quest": false,
        "can_change_world_state": false,
        "can_create_group": false,
        "can_modify_relationships_autonomously": false
      }
    },
    {
      "npc_id": "INKYUNG-NPC-002",
      "archetype": "teaching_assistant",
      "identity": {
        "name": "가유담",
        "age_band": "late_20s",
        "department_type": "engineering",
        "year_level": null
      },
      "personality": {
        "traits": [
          "wry",
          "cautious"
        ],
        "social_energy": 0.74,
        "talkativeness": 0.66,
        "routine_preference": 0.8
      },
      "speech": {
        "tone": "casual_polite",
        "tempo": "quick",
        "quirks": []
      },
      "interests": [
        "photography",
        "plants"
      ],
      "home_zone": "C04_INKYUNG",
      "schedule": {
        "morning": {
          "location": "inkyung_spawn",
          "activity": "wait",
          "social_mode": "medium"
        },
        "class_time": {
          "location": "transit_to_student_center",
          "activity": "walk",
          "social_mode": "medium"
        },
        "lunch": {
          "location": "inkyung_photo_point",
          "activity": "use_phone",
          "social_mode": "medium"
        },
        "evening": {
          "location": "inkyung_walkway",
          "activity": "talk_with_friend",
          "social_mode": "medium"
        }
      },
      "relationships": [],
      "dialogue_hooks": {
        "morning": [
          "아침 인경호 입구에서 잠깐 기다리고 있어요.",
          "잎에 맺힌 빛을 사진으로 남기고 싶네요."
        ],
        "class_time": [
          "수업 시간에는 학생회관 쪽으로 걸어가요.",
          "지나가며 나무 그림자 모양을 살펴봐요."
        ],
        "lunch": [
          "점심에는 사진 포인트에서 휴대폰 메모를 확인해요.",
          "방금 본 잎의 색을 잊기 전에 적어 둬요."
        ],
        "evening": [
          "저녁 산책로에서 친구와 짧게 이야기해요.",
          "걸으며 찍은 사진 중 한 장을 보여 주려 해요."
        ]
      },
      "behavior_tags": [
        "reserved",
        "observant"
      ],
      "constraints": {
        "is_authored_npc": false,
        "can_start_quest": false,
        "can_change_world_state": false,
        "can_create_group": false,
        "can_modify_relationships_autonomously": false
      }
    },
    {
      "npc_id": "INKYUNG-NPC-003",
      "archetype": "shop_worker",
      "identity": {
        "name": "나수현",
        "age_band": "30s",
        "department_type": "campus_service",
        "year_level": null
      },
      "personality": {
        "traits": [
          "curious",
          "patient"
        ],
        "social_energy": 0.72,
        "talkativeness": 0.57,
        "routine_preference": 0.42
      },
      "speech": {
        "tone": "casual_polite",
        "tempo": "slow",
        "quirks": []
      },
      "interests": [
        "music",
        "coding"
      ],
      "home_zone": "C04_INKYUNG",
      "schedule": {
        "morning": {
          "location": "inkyung_waterfront",
          "activity": "read",
          "social_mode": "medium"
        },
        "class_time": {
          "location": "transit_to_building",
          "activity": "walk_to_class",
          "social_mode": "medium"
        },
        "lunch": {
          "location": "transit_to_main_hall",
          "activity": "leave_zone",
          "social_mode": "medium"
        },
        "evening": {
          "location": "transit_to_main_hall",
          "activity": "walk_to_class",
          "social_mode": "medium"
        }
      },
      "relationships": [
        {
          "target_id": "INKYUNG-NPC-012",
          "type": "coworker"
        }
      ],
      "dialogue_hooks": {
        "morning": [
          "아침 호수 물가에서 읽던 글을 마저 봐요.",
          "조용한 곳에서 보면 문장이 조금 더 잘 들어와요."
        ],
        "class_time": [
          "수업 시간에는 건물 쪽으로 걸어가는 중이에요.",
          "걷는 동안 머릿속에 있던 코드 순서를 정리해요."
        ],
        "lunch": [
          "점심 무렵 본관 쪽으로 이동하며 이 구역을 떠나요.",
          "잠깐 들은 음악의 박자가 계속 생각나요."
        ],
        "evening": [
          "저녁에도 본관 방향으로 걸어가고 있어요.",
          "오늘 떠오른 코드 생각을 메모해 둘게요."
        ]
      },
      "behavior_tags": [
        "slow_paced",
        "photographer"
      ],
      "constraints": {
        "is_authored_npc": false,
        "can_start_quest": false,
        "can_change_world_state": false,
        "can_create_group": false,
        "can_modify_relationships_autonomously": false
      }
    },
    {
      "npc_id": "INKYUNG-NPC-004",
      "archetype": "teaching_assistant",
      "identity": {
        "name": "나도윤",
        "age_band": "50s_plus",
        "department_type": "social_sciences",
        "year_level": null
      },
      "personality": {
        "traits": [
          "playful",
          "curious"
        ],
        "social_energy": 0.49,
        "talkativeness": 0.23,
        "routine_preference": 0.64
      },
      "speech": {
        "tone": "casual_polite",
        "tempo": "slow",
        "quirks": [
          "short_sentences"
        ]
      },
      "interests": [
        "design",
        "photography"
      ],
      "home_zone": "C04_INKYUNG",
      "schedule": {
        "morning": {
          "location": "transit_to_main_hall",
          "activity": "leave_zone",
          "social_mode": "medium"
        },
        "class_time": {
          "location": "inkyung_photo_point",
          "activity": "take_photo",
          "social_mode": "medium"
        },
        "lunch": {
          "location": "inkyung_bench_east",
          "activity": "sit",
          "social_mode": "medium"
        },
        "evening": {
          "location": "inkyung_walkway",
          "activity": "talk_with_friend",
          "social_mode": "medium"
        }
      },
      "relationships": [],
      "dialogue_hooks": {
        "morning": [
          "아침에는 본관 쪽으로 이동하며 인경호를 떠나요.",
          "지나가는 장면의 색 배치가 눈에 남네요."
        ],
        "class_time": [
          "수업 시간 사진 포인트에서 한 장 찍어 봐요.",
          "같은 자리여도 각도를 바꾸면 느낌이 달라요."
        ],
        "lunch": [
          "점심엔 동쪽 벤치에 앉아 잠시 쉬어요.",
          "사진을 훑어보며 마음에 드는 구도를 골라요."
        ],
        "evening": [
          "저녁 산책로에서 친구 이야기를 듣고 있어요.",
          "디자인 이야기가 나오면 저도 말이 조금 빨라져요."
        ]
      },
      "behavior_tags": [
        "outgoing",
        "slow_paced"
      ],
      "constraints": {
        "is_authored_npc": false,
        "can_start_quest": false,
        "can_change_world_state": false,
        "can_create_group": false,
        "can_modify_relationships_autonomously": false
      }
    },
    {
      "npc_id": "INKYUNG-NPC-005",
      "archetype": "faculty",
      "identity": {
        "name": "나민서",
        "age_band": "40s",
        "department_type": "humanities",
        "year_level": null
      },
      "personality": {
        "traits": [
          "curious",
          "thoughtful"
        ],
        "social_energy": 0.86,
        "talkativeness": 0.34,
        "routine_preference": 0.72
      },
      "speech": {
        "tone": "warm",
        "tempo": "quick",
        "quirks": []
      },
      "interests": [
        "music",
        "reading",
        "walking"
      ],
      "home_zone": "C04_INKYUNG",
      "schedule": {
        "morning": {
          "location": "transit_to_student_center",
          "activity": "walk_to_club",
          "social_mode": "medium"
        },
        "class_time": {
          "location": "transit_to_student_center",
          "activity": "walk_to_club",
          "social_mode": "medium"
        },
        "lunch": {
          "location": "transit_to_building",
          "activity": "walk",
          "social_mode": "medium"
        },
        "evening": {
          "location": "transit_to_main_hall",
          "activity": "leave_zone",
          "social_mode": "medium"
        }
      },
      "relationships": [],
      "dialogue_hooks": {
        "morning": [
          "아침 학생회관 쪽으로 동아리 모임을 향해 걸어요.",